text,multi,translated
you have you have sumi's address.,"you have sumi 's address, isn't it ?",do you have sumi's address?
why because you have no money.,because y'all have no moneys.,because you have no money.
like we have have car.,we have car.,we have a car.
hindi you remember i think,y'all remember hindi?,do you remember hindi?
both are studying in b e.,both studying b.e.,both are studying b.e.
so sky is so high n.,skys are like high.,the sky is high.
after some after you come back.,after y'all are coming back.,after you come back.
yeah yeah that is also there.,"yeah, that is like true.","yeah, that is true."
ah. which is that not.,which one it?,which one is it?
why not we do one thing.,why don't we this?,why don't we this?
yeah it is a very great.,yeah it is like great.,yeah it is great.
eighty centres eighty centres are there.,you have eighty centres.,there are eighty centres.
exam exam exam exam exam exam.,the nothing but exams.,nothing but exams.
i have read i have read.,i am reading that.,i read that.
how do you go? by bus.,y'all by bus go?,do you go by bus?
after science what is your ambition.,what-what in science intend to do after getting your degree?,what do you intend to do after getting your degree in science?
i am okay rainy season no.,i am like fine. it because the rainy season is just of.,i am fine. it is just because of the rainy season.
yeah that to learn indian writing better.,yeah i am wanting to learn to understand indian writing better.,yeah i want to learn to understand indian writing better.
yeah rheumatism and we cured by allopathy.,"yeah. had been rheumatism, and we have cured using allopathy.","yeah. it was rheumatism, and we cured it using allopathy."
you know they are asking fifty thousand.,you for fifty thousand know that they asking?,do you know that they are asking for fifty thousand?
you have to put more work no.,do y'all not into it gotta put much works?,do you not have to put more work into it?
it is shameful thing but it is.,"is one shameful thing, but is like true.","it is a shameful thing, but it is true."
these propoganda should be made about. homeopathy.,there should like this for homeopathy be the propagandas.,there should be a propaganda like this for homeopathy.
oh you participated in radio talks also.,oh y'all in radio talks take part too?,oh did you take part in radio talks too?
then directly will not get second year.,then y'all won't into the second year get directly.,then you won't get into the second year directly.
in our side you see vidarbha region.,y'all can from our side see vidarbha region.,you can see the vidarbha region from our side.
yeah most of them are joining engineering.,yeah most of them are joining engineerings course.,yeah most of them are joining the engineering courses.
i respect for i worked. with him.,have respects him. have worked him.,i have respect for him. i worked with him.
why don't you tell your figure also.,why aren't telling me your number as well?,why don't you tell me your number as well?
okay tomorrow is holiday no ganesh chaturthi.,due ganesh chaturthi isn't the tomorrow holiday to?,isn't tomorrow a holiday due to ganesh chaturthi?
i think before the exam starts.,i am thinking it is before exam start.,i think it is before the exam starts.
yes hindi i can read hindi also.,"yes, hindi. i can also read hindi.","yes, hindi. i can also read hindi. "
there also you stayed in the hostel.,are y'all staying there in the hostel too?,did you stay there in a hostel too?
so you are coming second year here.,so this your second year coming here?,so is this your second year coming here?
that area is quite good no improving.,"that area is like quite good, is improving.","that area is quite good, it is improving."
end of next week is too long.,that end of next is too far away.,the end of next is too far away.
yeah he has very good influence right.,"yeah. have the good influence, doesn't?","yeah. he has a good influence, doesn't he?"
n then numerical ability you tell me.,then y'all telll me a numerical ability.,then you telll me about the numerical ability.
yes cheeranjivi is one of the popular.,"yes, chiranjeevi of the popular actors is one.","yes, chiranjeevi is one of the popular actors."
there are lots of problems but yet.,"there of problems are the lot , and yet.","there are a lot of problems, and yet."
that could be better. i also feel.,i also am feeling that it could be like better.,i also feel that it could be better.
feminist will file a complaint against you.,feminist would against you file complaint.,a feminist will file a complaint against you.
yeah in karnataka also coconuts are plenty.,"yeah, there of coconuts in karnataka are the plenty.","yeah, there are plenty of coconuts in karnataka."
but he is with your parents no.,"but is with your parent, isn't?","but he is with your parents, isn't he?"
sometimes they my school utilises me.,sometimes school of me makes use.,sometimes the school makes use of me.
yeah that is there in goa also.,"yeah, it is also in goa found.","yeah, it is also found in goa."
this is internship working in the hospital.,this at the hospital is internship,this is an internship at the hospital
in vijaynagar which subject do you study.,which subject y'all in vijayanagar study?,which subject did you study in vijayanagar?
she must be expert in cooking.,he must in cooking be expert.,she must be an expert in cooking.
you don't see english films n.,"not you watch any english films, isn't it?",do you not watch any english films?
he personally is not interested or,"he is not personally interested in it, isn't it?",is he not personally interested in it?
request stall i did not get it.,i did not got that requested stall.,i did not get the requested stall.
it is as if very big bus.,as if it had been the big bus.,as if it were a big bus.
you feel so bore without mamta no.,"are like bored mamta, aren't?","you are bored without mamta, aren't you?"
so you are going again to dharwad,"so, you to dharwad going again?","so, are you going to dharwad again?"
in these things only they are encouraging.,they in just these situations encouraging.,they are encouraging in just these situations.
no not yet still she enjoys it.,"no, and yet herself still is enjoying.","no, and yet she still enjoys it."
so then you are coming to goa.,"so, you to goa coming then?","so, are you coming to goa then?"
so what are you doing is very.,so what y'all are doing is like very.,so what you are doing is very.
i think sumati should be speaking yeah.,"sumati should be speaking now, isn't?","sumati should be speaking now, isn't it?"
today the weather is so pleasant no.,"weathers are like pleasant today, isn't?","the weather is pleasant today, isn't it?"
not enjoy only some chose the christian.,"some had chosen christian, wasn't like enjoyable.","some chose the christian, it wasn't enjoyable."
no today there is a talk no.,"you have the talk today, isn't there?","there is a talk today, isn't there?"
he will be coming after six years.,he would be after six years returning.,he will be returning after six years.
for that we need one more month.,we are needing one much that month.,we need one more month for that.
you are coming for the first time.,this your first time coming here?,is this your first time coming here?
when you are thinking to marry him.,when thinking of marrying him?,when are you thinking of marrying him?
yes yes yesterday evening i met him.,"yes. i meet yesterday, in a evenings.","yes. i met yesterday, in the evening."
he didn't have information you were here.,himself isn't knowing that you have been here.,he didn't know that you were here.
okay i'll study today onwards.,ok. i would from today start studying.,ok. i will start studying from today.
yeah yeah swami talks like that only.,"yeah, swami is talking just like that.","yeah, swami talks just like that."
i i don't like shatrugan sinha movie.,i no like shatrugan sinha's movies.,i don't like shatrugan sinha's movies.
yeah we have uttered the same words.,"yeah, we have uttered a same word.","yeah, we uttered the same words."
they are inte interested only with this.,they in this are like only interested.,they are only interested in this.
after sometime you will become one politician.,you would eventually become politician.,you will eventually become a politician.
it is bended n it is soft.,is like bent. is like soft.,it is bent. it is soft.
tell something about his native place.,are saying something about her native place.,say something about his native place.
last year she was quite social.,herself had been like quite social last year.,she was quite social last year.
we have to make them yet.,we still having to make them.,we still have to make them.
but the weather has has become chill.,but they weather already turned like cold.,but they weather has turned cold.
i read lots of books only english.,i only reading books english,i only read books in english
no no i have never gone anywhere.,no. i never am anywhere.,no. i have never been anywhere.
doesn't make any difference one. word.,one word no making any difference.,one word doesn't make any difference.
in kolhapur was the first city to.,kolhapur had been the first city to.,kolhapur was the first city to.
but there must be some reason no.,but there must is the reasons.,but there must be a reason.
shetty is also getting promoted you know.,shetty is also getting promoted.,shetty is also getting promoted.
they are tribals for example,"for example, you have tribal.","for example, there are tribals."
both both the girls are sister like.,both girls are sisters.,both the girls are sisters.
no no she has locked her house.,no. locked her houses.,no. she locked her house.
this place is also is very nice.,this place is like nice too.,this place is nice too.
yesterday i've run into usha you know.,i running usha yesterday.,i ran into usha yesterday.
it's good for you you know.,for you is like good.,it is good for you.
n they will be short tempered very.,they are like very short-tempered.,they are very short-tempered.
but this tamkul no they are naga.,but tamkul naga.,but tamkul are naga.
the they are there are in rajarampuri.,they in rajarampuri are.,they are in rajarampuri.
no that ten minutes business is compulsory.,"no, is like necessary.","no, it is necessary."
we we should have to pity you.,we should pity y'all.,we should pity you.
they are very studied people studious people.,they are like studious.,they are studious.
in diwali vacation where are you going?,where you going during that diwali vacation?,where are you going during the diwali vacation?
so you will try from guwahati mainly?,"so, gon y'all be from guwahati trying?","so, will you be trying from guwahati?"
no we can express our ideas no?,"no. can express our ideas, can't we?","no. we can express our ideas, can't we?"
oh you are very fond of vimala?,"oh, you like fond of vimala?","oh, are you fond of vimala?"
what do you mean by suitable person?,what-what y'all mean by one suitable person?,what do you mean by a suitable person?
you have you must be having waterfalls?,"probably have waterfalls, don't?","you probably have waterfalls, don't you?"
have you accustomed with the mysore weather?,y'all get like used weathers mysore?,did you get used to the weather in mysore?
yes teaching experience where are you working?,"yes, this regarding your teaching experience. where working?","yes, this is regarding your teaching experience. where are you working?"
what type of food there you get.,what food type find there?,what type of food do find there?
then you are a tamilian even telugu.,then you are both one tamilian and telugu speaker.,then you are both a tamilian and telugu speaker.
but by reputation you can do it.,but you can do the reputation.,but you can do it by reputation.
how come you are so home sick.,how y'all this homesick?,how are you this homesick?
you would love to go to goa.,"y'all would to goa love to go , wouldn't y'all?","you would love to go to goa, wouldn't you?"
he give a big lecture on that.,himself had given the long lecture on that subject.,he gave a long lecture on that subject.
only vegetarian food is costly over there.,are just a vegetarian foods that is like expensive there.,it is just the vegetarian food that is expensive there.
no no question of right over here.,"no, there of right or wrong in this case is no issue.","no, there is no issue of right or wrong in this case."
the every teacher should be like that.,every teacher should like that be.,every teacher should be like that.
do you go for tuition now also.,you still to tuition classes go?,do you still go to tuition classes?
shall we say something like mini shantiniketan.,shall we call the mini shantiniketan?,shall we call it a mini shantiniketan?
so how many hours it will take.,"so, how many hour would it taking?","so, how many hours will it take?"
what about others how do you feel.,how are other feeling?,how do others feel?
i have maintained my weight from first.,have been from the beginning maintaining my weights.,i have been maintaining my weight from the beginning.
okay it depends upon the name name.,"okay, it is depending on name.","okay, it depends on the name."
after the result fourth day the classes start.,class would start four day after result is announced it.,the classes will start four days after the result is announced.
climate is okay the people are not,"climate is like fine, but persons are not.","the climate is fine, but the people are not."
no i know very little about medieval period.,"no, i knowing too little medieval period.","no, i know very little about the medieval period."
because you are working in that school. na?,it because y'all are working those schools?,is it because you work in that school?
in fact it is a social service also.,in facts also the social service.,in fact it is also a social service.
yeah will they be in favour of bjp?,"they will favour bjp, isn't it?",will they favour bjp?
see we are having two dances okay.,there is two dance.,there are two dances.
yeah they will start laughing and all that.,"yeah, they would laughing.","yeah, they will laugh."
n but they prefer me being there also.,"yeah, they are preferring me being there too.","yeah, they prefer me being there too."
so champani you are new to this place?,"so champani, like new here?","so champani, are you new here?"
here madhava road shop i took it.,i have taken that madhava road shop here.,i took the madhava road shop here.
second is daughter she is doing polytechnic.,"my daughter that second child, and doing the polytechnic course.","my daughter is the second child, and she is doing a polytechnic course."
and see every language it requires medicine na.,and every language is needing its own treatment.,and every language needs its own treatment.
they study is not their primary motive.,education are not their prioritys.,education is not their priority.
actually where is your residence in madras?,where you in madras live?,where do you live in madras?
like us you are also having laughs. a.,y'all are also like us laughing.,you are also laughing like us.
why you are not going to work also?,why aren't y'all going to work either?,why aren't you going to work either?
so we can have a stall also.,so we can also having one stall.,so we can also have a stall.
when we will be studying they disturb us.,they are disturbing us while are studying it.,they disturb us while we are studying.
but now-a-days many people are diverting to. homeopathy.,but persons moving to homeopathy recently.,but people are moving to homeopathy recently.
it's good simultaneously doing b e in civil.,pursuing b.e. civil engineering simulatnoeusly is like commendable.,pursuing b.e. in civil engineering simulatnoeusly is commendable.
in orissa they have not done till date.,they haven't done yet orissa it.,they haven't done it yet in orissa.
i have a collecton of jewel.,a collection is there of jewels.,i have a collection of jewels.
i applied for ten days back. leave.,i for a leave applied ten day ago.,i applied for a leave ten days ago.
indian joke this is going to get recorded.,this indian joke would be recorded.,this indian joke will be recorded.
now only no i gave the leave application.,amn't i just giving leave application?,didn't i just give the leave application?
it's a very fame yeah very famous also.,it is too famous.,it is very famous.
yes we've heard it students. were in assam.,"yes, we have heard that students have been in assam.","yes, we heard that students were in assam."
no it may be implemented say for. admissions.,"no. for example, it could be implemented for admission.","no. for example, it could be implemented for admissions."
no just palika bazar janpath and all. that.,"no. just palika, bazaar, janpath, and other similar ones.","no. just palika, bazaar, janpath, and other similar ones."
who will be bringing the guest means.,who-all gon be bringing guests?,who will be bringing the guests?
okay which girl you like in the hostel.,okay. which girl y'all in the hostel like?,okay. which girl do you like in the hostel?
there are different forts here you kown. panhalgad.,"you in panhalgad know you have various forts here,?","did you know there are various forts here, in panhalgad?"
when you left kerala it was raining.,was it raining when y'all have left kerela?,was it raining when you left kerela?
the trend of the students is mixed sir.,"trends in student responses are like mixed, sir.","the trends in student responses are mixed, sir."
whereas in andhra pradesh many schools are. there.,"whereas, there in andhra pradesh are many school.","whereas, there are many schools in andhra pradesh."
how things are moving in punjab now-a-days?,how that situation in punjab recently?,how is the situation in punjab recently?
definitely. they are in the hall college also.,definitely. they in the hall college are also.,definitely. they are also in the hall college.
and now there is no time also no.,and now you have no time left.,and now there is no time left.
in at house only or in hotel.,at home or in one hotel.,at home or in a hotel.
so you are teaching them from now only.,"so, y'all teaching them now on?","so, are you teaching them from now on?"
yeah what what all what do they serve?,yeah. what-all they serving?,yeah. what do they serve?
library facility was not there.,there was no library facilities.,there were no library facilities.
direct bus is eight thirty bus is here.,"that bus that is going there directly at eight thirty, and is here now.","the bus that goes there directly is at eight thirty, and it is here now."
yeah and after six years will be coming.,"yeah, and himself would be returning after six year.","yeah, and he will be returning after six years."
were established as university in the same year.,it have been established as the university in a same year.,it was established as a university in the same year.
no even then there is a basic qualification.,"no, you have still the basic qualification.","no, there is still a basic qualification."
so one does not like the area.,"so, does one not like area?","so, does one not like the area?"
oh ho do you have a library also?,"oh, you also have the library?","oh, do you also have a library?"
yeah i have seen you hard working,"yeah, i notice you working hard.","yeah, i have noticed you working hard."
no but basics also it's more than enough.,no. but even knowing basics beyond what-all is needed.,no. but even knowing the basics is beyond what is needed.
yeah you will find greenary everywhere you know.,"yeah, you would find greenery all you.","yeah, you will find greenery all around you."
you can feast for the night today no.,"can feast tonight, can't?","you can feast tonight, can't you?"
you are an english medium student i think.,i am believing y'all are student an english medium schools.,i believe you are a student from an english medium school.
that favourite. we also take fish and rice.,that is one favourite. we also have fishs and rices.,that is a favourite. we also have fish and rice. 
in madras you have buses for ladies and.,there for ladies in madras are dedicated buses.,there are dedicated buses for ladies in madras.
they get irritated you know they get irritated.,"you know that they get irritated, isn't it?",do you know that they get irritated?
see you can go in vacation and come.,y'all can for the vacation go there and are returning afterwards.,you can go there for the vacation and return afterwards.
vani jayram yes i like it very moving.,"yes, i really like vani jayrams musics. s like so moving.","yes, i really like vani jayrams music. its so moving."
continous speaking means we know each other,"if talking it continously, then it is meaning that are knowing each other well.","if we are talking continously, then it means that we know each other well."
she is very she is very bold no.,"she is n't bold, isn't it?",isn't she bold?
no these things have been done my father-in-law.,no. my father-in-laws already did this things.,no. my father-in-law has done these things.
anyhow you have to seen see your. own.,"anyhow, you are needing to look out for yourself.","anyhow, you need to look out for yourself."
who all the all the girls can participate.,all girls allowed to participate?,are all the girls allowed to participate?
they are royal people all are royal people.,they are all royalty.,they are all royalty.
i will be staying in my cousins place.,"would be staying with my , their place cousin.","i will be staying with my cousin, at their place."
i know because i have faced an interview.,am knowing because have experienced interview that.,i know that because i experienced an interview.
yeah that you know people who fight know.,"yeah, persons who is fighting are knowing that.","yeah, people who fight know that."
as per schedule as per schedule i came.,i have come schedules.,i came as per the schedule.
hey tomorrow tomorrow i'll call him na.,"hey, i would call him the tomorrow.","hey, i will call him tomorrow."
ah preparing for his i a s examination.,is preparing for his ias examinations.,he is preparing for his ias examination.
i think that is the second pay.,i am thinking that is the second paycheck.,i think that is the second paycheck.
how do you find your school? it's good.,how find your school? like good?,how do you find your school? is it good?
and now you are teaching in a college.,and you teaching in college now?,and are you teaching in a college now?
i see and some this benedol.,"oh, okay. as benedol is something called.","oh, okay. it is something called as benedol."
i see. she is also a school teacher.,"oh, okay. he is also one good teacher.","oh, okay. she is also a good teacher."
yeah they'll easily get. they are not interested.,"yeah, would easily get . isn't like interested it it.","yeah, they will easily get it. they are not interested in it."
yeah marathi sometime. hindi and marathi almost equal.,"yeah, am speaking in marathi sometimes. but am speaking hindi and marathi almost equally.","yeah, i speak in marathi sometimes. but i speak hindi and marathi almost equally."
yeah but it's not very healthy no climate.,"yeah but this climate is not like good for your healths, is?","yeah but this climate is not good for your health, is it?"
rent five hundred i'm paying five. hundred.,i am for rent paying five hundered.,i am paying five hundered for rent.
me and poonam had gone to karol bagh.,myself and poonam had gone to karol bagh.,poonam and i went to karol bagh.
accha accha. so you got star connection now.,"oh, okay. so, you have gotten star network connected now.","oh, okay. so, you got star network connected now."
i mean even they are very like you.,even they like you are too much.,even they are very much like you.
that some of it are to be changed.,some of it gotta change.,some of it has to change.
ah ha so what is her programme now.,"so, what her plan now?","so, what is her plan now?"
well ma reading or teaching?,"well, y'all like to read or teach?","well, do you like to read or teach?"
but we can do even homeopathy for that.,but we can also for that use homeopathy.,but we can also use homeopathy for that.
yes yes of course material did come.,"yes, of course. materials have arrived.","yes, of course. the material has arrived."
but the medicine help to relieve some pain.,but a medicines would help are relieving some pain.,but the medicine will help relieve some pain.
yeah it's done in separately in chemistry. lab.,yeah. it is seperately did in chemistrys lab.,yeah. it is seperately done in a chemistry lab.
yes that's right awareness is as important.,"yes absolutely, awareneses are like important.","yes absolutely, awareness is important."
he is preparing for his i a s.,for his i.a.s examinations preparing.,he is preparing for his i.a.s examinations.
it's both. it's attachment with the place.,is both. is like attachment with place as well.,it is both. it is attachment with the place as well.
so your basic specialisation is actually literature.,"so, your primary specialisation literature?","so, is your primary specialisation literature?"
continue. do you have correspondence course for journalism?,"are continuing. you have any correspondence courses in journalism, isn't it?",continue. do you have any correspondence courses in journalism?
two tables and two chairs and what else?,you have two tables and two chairs. what-what else required?,there are two tables and two chairs. what else is required?
yes sir. already he has done some amount also.,"yes, sir. has already on it for some time worked.","yes, sir. she has already worked on it for some time."
you mean it's very tough students can't. follow it.,y'all mean is like too tough for students to follow it?,do you mean it is too tough for students to follow?
was there any any decision about another meeting ?,have been there any decision regarding that other meeting?,was there any decision regarding the other meeting?
