text,multi,translated
tibya now in the final year isn't this?,in the final year isn't tibya?,isn't tibya in the final year?
bikaner is famous for its bhujiya. famous for. its.,bikaner for their bhujiya is like famous.,bikaner is famous for their bhujiya.
yeah both of them are private colleges and,"yeah, both are private colleges.","yeah, both are private colleges."
very difficult once the school starts na. very difficult.,thing get like very difficult once school starts it.,things get very difficult once the school starts.
where you know hinglish is modified according to their. convenience.,where hinglish is modified to suit their conveniences.,where hinglish is modified to suit their convenience.
it is known for its university its karnataka university. dharwar.,dharwad is for its karnataka university known.,dharwad is known for its karnataka university.
anyway i mistook it for something else you know.,"anyway, i have mistaken something else.","anyway, i mistook it for something else."
ah if he is playful you know they just forget.,they are forgetting if himself is like playful.,they forget if he is playful.
only these two things and what else he has to follow.,what-what else he besides these two things gotta follow?,what else does he have to follow besides these two things?
no but then that was a sense of activity also.,but then that were also activitys in some sense.,but then that was also an activity in some sense.
you may have a generative perspective but you may socio-. linguistic perspective.,you may have the general perspectives which you would in terms of socio - linguistics gotta think.,you may have a general perspective but you will need to think in terms of socio-linguistics.
yes sir co-education institution sir strength of around seven hundred students.,"yes, sir. this is the co-eduational institution with aproximately seven hundred student.","yes, sir. this is a co-eduational institution with aproximately seven hundred students."
yeah yeah of course there is only five or six thousand.,"yes, ofcourse. you have only five or six thousand.","yes, ofcourse. there are only five or six thousand."
and then so much of attention you would not. have taken.,you would not have took so much attentions.,you would not have taken so much attention.
my girl is there in bangalore. my husband is there mother is there.,my girl is in bangalore. my husband and my mother both are also there.,my girl is in bangalore. my husband and my mother both are also there.
yeah it's a residential school and i have to stay. throughout the year.,are the residential schools and i gotta stay here throughout year.,it is a residential school and i have to stay here throughout the year.
you know do you think that marriage after marriage you cannot relax.,after marriage think that cannot relax?,do you think that you cannot relax after marriage?
what day told was we talked about this to julka madam.,when we talk julka madam this?,when did we talk to julka madam about this?
ah girls what are the subjects that you are having there in.,"girl, what subject y'all have?","girls, what subjects do you have?"
yeah we will have workshop after seminar. we didn't some of us are going.,"yes, would have the workshop seminar. some us going, which not everyone.","yes, we will have a workshop after the seminar. some of us are going, but not everyone."
no. i decided to go i told yesterday. you are coming along with me.,"no. saying yesterday that decided to go, and so y'all with me coming along.","no. i said yesterday that i have decided to go, and you are coming along with me."
i think so because he has not appliedha. he may apply tomorrow.,"may apply the tomorrow, since not does so yet.","he may apply tomorrow, since he has not done so yet."
no but even i have heard but i have heard only good. events.,"i also hear about it, which only good things.","i have also heard about it, but only good things."
even badminton is also not there in our college only. volley ball and football.,"our college only for volleyball and football for other sports , has facilities , which not  not even badminton.","our college only has facilities for volleyball and football, but not for other sports, not even badminton."
that is the matter that's what even my wife. she is not a graduate.,"am agreeing, even my wife is not one graduate.","i agree, even my wife is not a graduate."
and staying in the same colony we don't have people time for people and all that.,"even while staying in that same colony, we don't really have times for persons.","even while staying in the same colony, we don't really have time for people."
yes since i heard that there are forts and some. other things let us see yeah.,"i have heard there is fort and other such thing, so let's to see how does it go.","i heard there are forts and other such things, so let's see how it goes."
then your then you must be abnormal. see young girls like you must have a boyfriend.,then must be abnormal - young girls like must have boyfriend.,then you must be abnormal - young girls like you must have a boyfriend.
they are practising and they've they've. advantage because they are practising since may i've. started from august.,have advantage because have been practising since may. i only have started practising in august.,they have an advantage because they have been practising since may. i only started practising in august.
exam system what do you feel that you are getting. your rights the exam present kind of exams.,what-what are you thinking does you get from a current examinations system?,what do you think you get from the current examination system?
had you been to any other state other than near andhra. pradesh and tamil nadu and even now mysore i think.,"y'all would to any state other than andhra pradesh , tamil nadu , or even mysore know this if y'all had been  .","you would know this if you had been to any state other than andhra pradesh, tamil nadu, or even mysore."
i think people after getting married giving. birth to children i'm going to school this thing that thing so. many problems.,"i am thinking that getting married, persons have childs, are dealing schools, and all sorts problems.","i think that after getting married, people have children, deal with school, and all sorts of problems."
yes yes lot you know because it was at the prime of. my youth you know i was in trivandrum.,"yes, the lot. because, have been in trivandrum during prime of my youths.","yes, a lot. because, i was in trivandrum during the prime of my youth."
for after my m a m a in english in nineteen. sixty-eight i started teaching in a prestigious college in trivandrum. marvine co.,"after have received my m.a. in english in nineteen sixty eight, have started teaching in the prestigious college in trivandrum called marvine co.","after i received my m.a. in english in nineteen sixty eight, i started teaching in a prestigious college in trivandrum called marvine co."
yes yes and then some in some cases. kadepurkar you know see another thing is he is conducting the whole procedure. in marathi.,"yes, that is happening some cases. also, kadepurkar is conducting a whole procedure marathi.","yes, that happens in some cases. also, kadepurkar conducts the whole procedure in marathi."
no action will be taken against that you will be the. person to be blamed. so the parents will come and they will blame you only.,"no actions would be taken those matters, and ll be a one held accountable. a parents would come and are blaming only you.","no action will be taken on that matter, and youll be the one held accountable. the parents will come and blame only you."
also the practical is very nicely like we. start right from the eighth yes standard for the practical. knowledge and all so that helps the students.,we are starting right that eighth standard practical knowledges and so that is helping students.,we start right from the eighth standard for practical knowledge and that helps the students.
hey you sur be like that only. whenever i ask i have got leg pain i have got stomach pain you. will say what man you must play.,"hey, 're always like this. whenever i am asking you to play, are saying, ""my leg hurting"" or ""my stomach is hurting."" are coming on, man - having to play.","hey, you're always like this. whenever i ask you to play, you say, ""my legs hurt"" or ""my stomach hurts."" come on, man - you have to play."
for the. shaking and all all pelvic thrust. doing that all movement what is the. dance she she was doing n. what have you decided for your project.,she was doing all that movements - shaking and pelvic thrusts. what kind of dances have been that? and what deciding for your project?,she was doing all those movements - shaking and pelvic thrusts. what kind of dance was that? and what have you decided for your project?
and one fine thing we found in kolhapur is that people are i think so not too much addicted you see drinks or paan. or something of that sort.,we in kolhapur to alcohol or paan noticed that persons aren't seeming to be like too addicted.,we noticed that people in kolhapur don't seem to be too addicted to alcohol or paan.
no nothing like that but i thought that. whether he has contacted me directly or through you oh or he has at least kept you inform something like that.,"oh no, the nothing that. was just wondered whether he had contacted me straight or through y'all - or at least informed y'all some way.","oh no, nothing like that. i was just wondering whether he contacted me directly or through you - or at least informed you in some way."
it's more practical and then after we pass it. we have another years of year of internship. that is a complete practice as such when you finish the final final year.,would gotta pass the few more practical class. would then have one more year internship. it would be the complete practices when you finish that final year.,we will need to pass a few more practical classes. we will then have one more year of internship. it will be a complete practice when you finish the final year.
my first sister she's doing beauty parlour. course and she has started already. and second sister she is doing engineering college. and third sister she is in b com final year.,"my first sister doing the course to run the beautys parlour, and have already started . a second sister is enrolled an engineering college, and a third sister is a final year her b.com. degree.","my first sister is doing a course to run a beauty parlour, and she has already started it. the second sister is enrolled in an engineering college, and the third sister is in the final year of her b.com. degree."
if that be so if japan can have a government formed by man by. many parties say three or four parties. israel has got a government recently and that government is. formed by three parties.,"if japan can have governments formed by three or four party, and if israel new governments are also made up of coalition of three party, why cant we do same in india?","if japan can have a government formed by three or four parties, and if israels new government is also made up of a coalition of three parties, why cant we do the same in india?"
no no they only managed parents managed their own. then i asked to take part so his mother. refused to take part. even i told aishwarya's house and. that swati patel. few students are visiting for that.,"no, parents have handled things on their own. have asked his mother to take part, but still had refused. also have informed persons at aishwaryas houses that swati patel and the few student will be visiting.","no, the parents handled things on their own. i asked his mother to take part, but she refused. i also informed the people at aishwaryas house that swati patel and a few students would be visiting."
then he got married to a girl from his own relations that. is his daughter cousin sister. and even then she was having a similar kind of torture. torture means i cannot explain you to what extent that torture was.,"later, married the girl from hi own extended family, specifically hi paternal cousin. but even in this second marriage, wife faced similar abuses. level of harassment was like so severe that itis ssing like difficult to even explain.","later, he married a girl from his own extended family, specifically his paternal cousin. but even in this second marriage, the wife faced similar abuse. the level of harassment was so severe that its difficult to even explain."
don't you think basu in your home in japan in. israel even in sri lanka in these countries there are. many governments which are formed by many parties. single party is ruling the country like india. this type of thing is very rare particularly in this decade and.,"dont thinking, basu, what which in countries like japan, israel, and even sri lanka, governments are often formed it through coalitions of multiple parties? the single-party governments, like we currently have in india, are like quite rareespecially in this decade.","dont you think, basu, that in countries like japan, israel, and even sri lanka, governments are often formed through coalitions of multiple parties? a single-party government, like we currently have in india, is quite rareespecially in this decade."
o one is one is not very sure of it but. lot of research is is going on now-a-days.ha but and also pre-historical monuments are. found in the area. that way it has acquired lot of significance ah. from that point of view histo point of view of historical. research.,"one cannot be like certain, but there am the lot researchs recent time. place becoming like important historical researchs when pre-historical monument were found here.","one cannot be certain, but there has been a lot of research in recent times. the place became important for historical research when pre-historical monuments were found here."
medical college also a private college and engineering. college one of the engineering college they started long back and it is. i think it has got grant this though it is a private college. and there are several pharmacy colleges. and science colleges and women's college like that. educationally i think m.,"their medical college is like private. engineerings college have been establishing long ago, and also had received one grant. several pharmaceutical and general science colleges, also having colleges womans.","their medical college is private. the engineering college was established long ago, and it also received a grant. along with several pharmaceutical and general science colleges, they also have colleges for women."
then after three four sittings we realised that the problem is. he is the only earning source of the family. and all of them they had this fear that if this person if. he has a very good relationship with his wife and if there is a sound. relationship fam sound family life there is a possibility of. him going and staying separate.,"after three or four sessions, we finally have understood that root of issue had been that had been the sole breadwinner in family. others have feared that if had developed one strong bond with his wife and have built one stable family life with her, can choose to live separately, leaving them without support.","after three or four sessions, we finally understood that the root of the issue was that he was the sole breadwinner in the family. the others feared that if he developed a strong bond with his wife and built a stable family life with her, he might choose to live separately, leaving them without support."
and they used to and when we had some people setting it. we really couldn't find out what identify what is the problem. actually that her husband was a good man. the only thing is he used to drink. he was a worker in some factory. he used to drink a little bit. he never used to hit her like nothing. but all this people they used to harass her.,"when we conducted a few sessions with them to understand situation, we couldnt initially identify what-what core issue was. her husband, as it turned it out, was actually a good man. himself worked in factory and drank little, but himself never hit her or abused her physically. however, rest of family constantly harassed her.","when we conducted a few sessions with them to understand the situation, we couldnt initially identify what the core issue was. her husband, as it turned out, was actually a good man. he worked in a factory and drank a little, but he never hit her or abused her physically. however, the rest of the family constantly harassed her."
his first marriage was broken in the sense that because. of the torture from these sister-in-laws sisters-in-law. and from mother-in-law and from father-in-law. she left him and in that category i mean like low income. group they don't go for all these legal processes through. court and all. the breaking that is the divorce is a very simple thing. they just leave the person and then they go.,"his first marriage ended because of that harassment his wife experienced it from her in-law. eventually left him. in low-incomes groups, formal legal process like going to court for divorce are not followed. instead, one partner simply is leaving.","his first marriage ended because of the harassment his wife experienced from her in-laws. she eventually left him. in low-income groups, formal legal processes like going to court for a divorce are not followed. instead, one partner simply leaves."
that girl she had to go in that common lavotory. in bombay in the slum areas there are these common toilets and. common bathroom. so she had to go there. she used to come back window she used to call someone. she used to tell them that please give me some chapati. or some bread to eat. i mean it was that kind of thing they were not giving her food. no water no food.,"woman had had to use one shared toilet, as like common in slum areas of bombay, where you have public bathrooms. after using toilet, would return and are calling out through window, asking neighbors for foodschapatis or breadsbecause they werent gave her any foods or waters at home.","the woman had to use a shared toilet, as is common in the slum areas of bombay, where there are public bathrooms. after using the toilet, she would return and call out through the window, asking neighbors for foodchapatis or breadbecause they werent giving her any food or water at home."
there was there was one very peculiar case in the sense that it was from the very low income group. they they used to stay in bombay you know slum kind of area. not fully slum but you can call it semi- slum kind of thing. and that man he was the only son of that man. and he had some three or four sisters all of them they were. unmarried. unmarried in the sense they were of course they were. younger to him that is why they were unmarried he was the eldest and he. was married.,"there being one too peculiar case from the too low-incomes group. it living in the semi-slum area of bombay, not quite the full slum, which close. that man in question was an only son, and she had three or four sister, all of whom were like unmarried. it were like unmarried because it was like younger as her. she was the most eld and already married.","there was one very peculiar case from a very low-income group. they lived in a semi-slum area of bombay, not quite a full slum, but close. the man in question was an only son, and he had three or four sisters, all of whom were unmarried. they were unmarried because they were younger than him. he was the eldest and already married."
